{
  "schema_version": "jjukkumi.hermes-capabilities/v1",
  "probed_at": "2026-08-19T02:00:00+09:00",
  "hermes_version": "REPLACE_WITH_VERIFIED_VERSION",
  "interface": "public_cli",
  "capabilities": {
    "durable_acceptance": false,
    "submit_idempotency_key": false,
    "lookup_by_idempotency_key": false,
    "lookup_by_external_ref": false,
    "resource_mutex": false,
    "execution_status": false,
    "cancellation": false,
    "result_receipt": false
  },
  "limits": {},
  "evidence": [],
  "notes": [
    "This file is an unverified template. E0-T4 must replace every value with evidence from the real public Hermes interface."
  ]
}
